{
  "schema": "pulsetensor/work-receipt/v1",
  "receiptVersion": "1",
  "chainId": 943,
  "settlementContract": "0x1111111111111111111111111111111111111111",
  "taskId": "0xaaaaaaaaaaaaaaaaaaaaaaaaaaaaaaaaaaaaaaaaaaaaaaaaaaaaaaaaaaaaaaaa",
  "attemptId": "0x0404040404040404040404040404040404040404040404040404040404040404",
  "taskSpecHash": "0x0505050505050505050505050505050505050505050505050505050505050505",
  "provider": "0x4444444444444444444444444444444444444444",
  "inputCommitment": "0xbbbbbbbbbbbbbbbbbbbbbbbbbbbbbbbbbbbbbbbbbbbbbbbbbbbbbbbbbbbbbbbb",
  "outputCommitment": "0x0606060606060606060606060606060606060606060606060606060606060606",
  "evidenceRoot": "0x0707070707070707070707070707070707070707070707070707070707070707",
  "availabilityAttestationRoot": "0x0808080808080808080808080808080808080808080808080808080808080808",
  "canonicalSemanticsId": "0xdddddddddddddddddddddddddddddddddddddddddddddddddddddddddddddddd",
  "assuranceMode": "STATISTICAL",
  "proofSystemId": "0x0909090909090909090909090909090909090909090909090909090909090909",
  "verifierId": "0x1010101010101010101010101010101010101010101010101010101010101010",
  "modelArtifactHash": "0x1212121212121212121212121212121212121212121212121212121212121212",
  "runtimeArtifactHash": "0x1313131313131313131313131313131313131313131313131313131313131313",
  "tcbManifestHash": "0x1414141414141414141414141414141414141414141414141414141414141414",
  "startedAtBlock": "1001",
  "submittedAtBlock": "1099",
  "providerNonce": "9",
  "providerSignature": "0x2222222222222222222222222222222222222222222222222222222222222222222222222222222222222222222222222222222222222222222222222222222222"
}
